Sheet: 月間売上
B1: 月間売上
B3: 日付 | C3: アイスクリーム | D3: ガム | E3: 弁当 | F3: おにぎり | G3: お菓子 | H3: 雑誌 | I3: タバコ | J3: 日計
B4: 2014-02-01T00:00:00.000 | C4: 1000 | D4: 2000 | E4: 3000 | F4: 4000 | G4: 5000 | H4: 6000 | I4: 7000 | J4: =SUM(RC[-7]:RC[-1]) -> 28000
B5: 2014-02-02T00:00:00.000 | C5: 1000 | D5: 2000 | E5: 3000 | F5: 4000 | G5: 5000 | H5: 6000 | I5: 7000 | J5: =SUM(RC[-7]:RC[-1]) -> 28000
B6: 2014-02-03T00:00:00.000 | C6: 1000 | D6: 2000 | E6: 3000 | F6: 4000 | G6: 5000 | H6: 6000 | I6: 7000 | J6: =SUM(RC[-7]:RC[-1]) -> 28000
B7: 2014-02-04T00:00:00.000 | C7: 1000 | D7: 2000 | E7: 3000 | F7: 4000 | G7: 5000 | H7: 6000 | I7: 7000 | J7: =SUM(RC[-7]:RC[-1]) -> 28000
B8: 2014-02-05T00:00:00.000 | C8: 1000 | D8: 2000 | E8: 3000 | F8: 4000 | G8: 5000 | H8: 6000 | I8: 7000 | J8: =SUM(RC[-7]:RC[-1]) -> 28000
B9: 2014-02-06T00:00:00.000 | C9: 1000 | D9: 2000 | E9: 3000 | F9: 4000 | G9: 5000 | H9: 6000 | I9: 7000 | J9: =SUM(RC[-7]:RC[-1]) -> 28000
B10: 2014-02-07T00:00:00.000 | C10: 1000 | D10: 2000 | E10: 3000 | F10: 4000 | G10: 5000 | H10: 6000 | I10: 7000 | J10: =SUM(RC[-7]:RC[-1]) -> 28000
B11: 2014-02-08T00:00:00.000 | C11: 1000 | D11: 2000 | E11: 3000 | F11: 4000 | G11: 5000 | H11: 6000 | I11: 7000 | J11: =SUM(RC[-7]:RC[-1]) -> 28000
B12: 2014-02-09T00:00:00.000 | C12: 1000 | D12: 2000 | E12: 3000 | F12: 4000 | G12: 5000 | H12: 6000 | I12: 7000 | J12: =SUM(RC[-7]:RC[-1]) -> 28000
B13: 2014-02-10T00:00:00.000 | C13: 1000 | D13: 2000 | E13: 3000 | F13: 4000 | G13: 5000 | H13: 6000 | I13: 7000 | J13: =SUM(RC[-7]:RC[-1]) -> 28000
B14: 2014-02-11T00:00:00.000 | C14: 1000 | D14: 2000 | E14: 3000 | F14: 4000 | G14: 5000 | H14: 6000 | I14: 7000 | J14: =SUM(RC[-7]:RC[-1]) -> 28000
B15: 2014-02-12T00:00:00.000 | C15: 1000 | D15: 2000 | E15: 3000 | F15: 4000 | G15: 5000 | H15: 6000 | I15: 7000 | J15: =SUM(RC[-7]:RC[-1]) -> 28000
B16: 2014-02-13T00:00:00.000 | C16: 1000 | D16: 2000 | E16: 3000 | F16: 4000 | G16: 5000 | H16: 6000 | I16: 7000 | J16: =SUM(RC[-7]:RC[-1]) -> 28000
B17: 2014-02-14T00:00:00.000 | C17: 1000 | D17: 2000 | E17: 3000 | F17: 4000 | G17: 5000 | H17: 6000 | I17: 7000 | J17: =SUM(RC[-7]:RC[-1]) -> 28000
B18: 2014-02-15T00:00:00.000 | C18: 1000 | D18: 2000 | E18: 3000 | F18: 4000 | G18: 5000 | H18: 6000 | I18: 7000 | J18: =SUM(RC[-7]:RC[-1]) -> 28000
B19: 2014-02-16T00:00:00.000 | C19: 1000 | D19: 2000 | E19: 3000 | F19: 4000 | G19: 5000 | H19: 6000 | I19: 7000 | J19: =SUM(RC[-7]:RC[-1]) -> 28000
B20: 2014-02-17T00:00:00.000 | C20: 1000 | D20: 2000 | E20: 3000 | F20: 4000 | G20: 5000 | H20: 6000 | I20: 7000 | J20: =SUM(RC[-7]:RC[-1]) -> 28000
B21: 2014-02-18T00:00:00.000 | C21: 1000 | D21: 2000 | E21: 3000 | F21: 4000 | G21: 5000 | H21: 6000 | I21: 7000 | J21: =SUM(RC[-7]:RC[-1]) -> 28000
B22: 2014-02-19T00:00:00.000 | C22: 1000 | D22: 2000 | E22: 3000 | F22: 4000 | G22: 5000 | H22: 6000 | I22: 7000 | J22: =SUM(RC[-7]:RC[-1]) -> 28000
B23: 2014-02-20T00:00:00.000 | C23: 1000 | D23: 2000 | E23: 3000 | F23: 4000 | G23: 5000 | H23: 6000 | I23: 7000 | J23: =SUM(RC[-7]:RC[-1]) -> 28000
B24: 2014-02-21T00:00:00.000 | C24: 1000 | D24: 2000 | E24: 3000 | F24: 4000 | G24: 5000 | H24: 6000 | I24: 7000 | J24: =SUM(RC[-7]:RC[-1]) -> 28000
B25: 2014-02-22T00:00:00.000 | C25: 1000 | D25: 2000 | E25: 3000 | F25: 4000 | G25: 5000 | H25: 6000 | I25: 7000 | J25: =SUM(RC[-7]:RC[-1]) -> 28000
B26: 2014-02-23T00:00:00.000 | C26: 1000 | D26: 2000 | E26: 3000 | F26: 4000 | G26: 5000 | H26: 6000 | I26: 7000 | J26: =SUM(RC[-7]:RC[-1]) -> 28000
B27: 2014-02-24T00:00:00.000 | C27: 1000 | D27: 2000 | E27: 3000 | F27: 4000 | G27: 5000 | H27: 6000 | I27: 7000 | J27: =SUM(RC[-7]:RC[-1]) -> 28000
B28: 2014-02-25T00:00:00.000 | C28: 1000 | D28: 2000 | E28: 3000 | F28: 4000 | G28: 5000 | H28: 6000 | I28: 7000 | J28: =SUM(RC[-7]:RC[-1]) -> 28000
B29: 2014-02-26T00:00:00.000 | C29: 1000 | D29: 2000 | E29: 3000 | F29: 4000 | G29: 5000 | H29: 6000 | I29: 7000 | J29: =SUM(RC[-7]:RC[-1]) -> 28000
B30: 2014-02-27T00:00:00.000 | C30: 1000 | D30: 2000 | E30: 3000 | F30: 4000 | G30: 5000 | H30: 6000 | I30: 7000 | J30: =SUM(RC[-7]:RC[-1]) -> 28000
B31: 2014-02-28T00:00:00.000 | C31: 1000 | D31: 2000 | E31: 3000 | F31: 4000 | G31: 5000 | H31: 6000 | I31: 7000 | J31: =SUM(RC[-7]:RC[-1]) -> 28000
B35: 科目計 | C35: =SUM(R[-31]C:R[-1]C) -> 28000 | D35: =SUM(R[-31]C:R[-1]C) -> 56000 | E35: =SUM(R[-31]C:R[-1]C) -> 84000 | F35: =SUM(R[-31]C:R[-1]C) -> 112000 | G35: =SUM(R[-31]C:R[-1]C) -> 140000 | H35: =SUM(R[-31]C:R[-1]C) -> 168000 | I35: =SUM(R[-31]C:R[-1]C) -> 196000 | J35: =SUM(R[-31]C:R[-1]C) -> 784000